index,published,keyword,domain,language,valid,title,description,url,image,archive,content,quote,de,en,la,added
4ab4d155bda54024232128a7dd420356,2026-02-02T17:28:21Z,'Orkan',www.bild.de,de,0.9,"Orkan, Schnee und meterhohe Wellen - Bombenzyklon tobt an US-Küste","Häuser stürzen ins Meer – Sturm rast über die US-Ostküste! Ein Bombenzyklon trifft die Inselküste von North Carolina mit voller Wucht. Orkanböen, Schnees...",https://www.bild.de/news/ausland/orkan-schnee-und-meterhohe-wellen-bombenzyklon-tobt-an-us-kueste-6980cc2478c88161f9da4deb,"https://images.bild.de/6980cc2478c88161f9da4deb/f40b3311a711d85415f1160bf2e5d52c,d358e970?w=1280",http://web.archive.org/web/20260202181753/https://www.bild.de/news/ausland/orkan-schnee-und-meterhohe-wellen-bombenzyklon-tobt-an-us-kueste-6980cc2478c88161f9da4deb,"Mehr zum Video anzeigen 
Häuser stürzen ins Meer Sturm rast über die US-Ostküste! Ein Bombenzyklon trifft die Inselküste von North Carolina mit voller Wucht. Orkanböen, Schneesturm, meterhohe Wellen… [+76 chars]",,"Orkan, Schnee und meterhohe Wellen - Bombenzyklon tobt an US-Küste. Häuser stürzen ins Meer – Sturm rast über die US-Ostküste! Ein Bombenzyklon trifft die Inselküste von North Carolina mit voller Wucht. Orkanböen, Schnees...","Hurricane, snow and meter-high waves - bomb cyclone rages on the US coast. Houses fall into the sea – storm hits the US East Coast! A bomb cyclone hits the North Carolina island coast with full force. Hurricane gusts, snow...","Procellae, nix et undae altae metri - bomb cyclone in oram US saevit. Domus in mare cadunt – tempestas US Orientem Coast pervenit! Circulus bombae septentrionalis Carolinae insulae oram cum copiis omnibus ferit. Procellae procellis, nivis...",2026-02-03 19:14:58+00:00
d0ea3d9e6b1e2cbd01ad69f8f8874c44,2026-02-05T09:53:38Z,'Sturm Tote',www.n-tv.de,de,0.8,"Zehn Tote durch ""Kristin"": Portugals Wirtschaftsminister befürchtet Milliardenschäden durch Sturm","Milliardenschäden, Evakuierungen und Tote: Die Stürme in Portugal und Spanien ziehen schwere Folgen nach sich. Der Wirtschaftsminister beziffert die Schäden. Die Behörden warnen derweil vor weiteren Unwettern in den kommenden Tagen.",https://www.n-tv.de/panorama/Portugals-Wirtschaftsminister-befuerchtet-Milliardenschaeden-durch-Sturm-id30327111.html,https://www.n-tv.de/img/30327133/1770284909/Img_16_9/1200/In-Porto-Portugal-on-January-30-Storm-Kristin-passes-through-Portugal-causing-large-waves-at-Farolim-de-Felgueiras.jpg,http://web.archive.org/web/20260205174002/https://www.n-tv.de/panorama/Portugals-Wirtschaftsminister-befuerchtet-Milliardenschaeden-durch-Sturm-id30327111.html,"Das Atlantiktief ""Leonardo"" sorgt seit Mittwoch auch in Spanien mit Starkregen und stürmischen Winden vor allem im Süden für chaotische Verhältnisse. (Foto: picture alliance / NurPhoto)
Milliardensc… [+1769 chars]",,"Zehn Tote durch ""Kristin"": Portugals Wirtschaftsminister befürchtet Milliardenschäden durch Sturm. Milliardenschäden, Evakuierungen und Tote: Die Stürme in Portugal und Spanien ziehen schwere Folgen nach sich. Der Wirtschaftsminister beziffert die Schäden. Die Behörden warnen derweil vor weiteren Unwettern in den kommenden Tagen.","Ten dead from “Kristin”: Portugal’s economy minister fears billions in damage from the storm. Billions in damage, evacuations and deaths: the storms in Portugal and Spain have serious consequences. The Minister of Economic Affairs quantifies the damage. The authorities are now warning of further storms in the coming days.","Decem mortui ex ""Kristin"": oeconomia Portugalliae minister billions in damno tempestatis timet. Billions in damnum, evacuationes et mortes: procellae in Portugallia et Hispania graves consectaria habent. Minister rerum oeconomicarum quantitat damnum. Auctoritates nunc admonent de ulterioribus tempestatibus in futuro tempore.",2026-02-07 03:35:35+00:00
0129abaccbc2d88da08030a6eabc53d1,2026-02-05T10:02:52Z,'Sturm Tote',www.zeit.de,de,0.8,Sturmtiefs in Portugal und Spanien: Bereits elf Tote durch Winterstürme in Portugal,Durch heftige Stürme sind in Portugal und Spanien bereits mehrere Menschen ums Leben gekommen. In Portugal beläuft sich der entstandene Schaden auf vier Milliarden Euro.,https://www.zeit.de/gesellschaft/zeitgeschehen/2026-02/unwetter-portugal-spanien-sturm-atlantiktief-kristin-leonardo-gxe,https://img.zeit.de/gesellschaft/zeitgeschehen/2026-02/unwetter-portugal-spanien-sturm-atlantiktief-kristin-leonardo-bild/wide__1300x731,http://web.archive.org/web/20260206053811/https://www.zeit.de/gesellschaft/zeitgeschehen/2026-02/unwetter-portugal-spanien-sturm-atlantiktief-kristin-leonardo-gxe,"In Portugal ist durch ein neues Sturmtief ein weiterer Mensch ums Leben gekommen. Ein 70-Jähriger sei tot in seinem Auto 
gefunden worden, das in einem Fluss in der Gemeinde Serpa unter Wasser 
gel… [+2603 chars]",,Sturmtiefs in Portugal und Spanien: Bereits elf Tote durch Winterstürme in Portugal. Durch heftige Stürme sind in Portugal und Spanien bereits mehrere Menschen ums Leben gekommen. In Portugal beläuft sich der entstandene Schaden auf vier Milliarden Euro.,"Storms in Portugal and Spain: Eleven dead from winter storms in Portugal. Severe storms have already killed several people in Portugal and Spain. In Portugal, the damage caused amounts to four billion euros.",Tempestates in Lusitania et Hispania: Undecim tempestatibus hiemalibus in Portugallia mortui sunt. Gravissimae tempestates iam complures in Lusitania et Hispania necaverunt. In Portugallia damnum quattuor miliarda euronum attulit.,2026-02-07 03:35:35+00:00
